<?xml version="1.0" encoding="UTF-8"?>
<!DOCTYPE mapper PUBLIC "-//dbvisitor.net//DTD Mapper 1.0//EN"
        "https://www.dbvisitor.net/schema/dbvisitor-mapper.dtd">
<mapper namespace="net.hasor.dbvisitor.test.realdb.redis.api.mapper.RedisXmlRefMapperDao">
    <select id="selectByAgeRange" resultType="net.hasor.dbvisitor.test.contract.material.model.UserInfo" resultTypeHandler="net.hasor.dbvisitor.types.handler.json.JsonTypeHandler"> ZRANGEBYSCORE @{macro, redisAges} #{range.minAge} #{range.maxAge} </select>
    <select id="selectByBean" resultType="net.hasor.dbvisitor.test.contract.material.model.UserInfo" resultTypeHandler="net.hasor.dbvisitor.types.handler.json.JsonTypeHandler"> ZRANGEBYSCORE #{user.name} #{user.age} +inf </select>
    <select id="selectByIds" resultType="net.hasor.dbvisitor.test.contract.material.model.UserInfo" resultTypeHandler="net.hasor.dbvisitor.types.handler.json.JsonTypeHandler"> ZUNION #{ids.size()} <foreach collection="ids" item="item" separator=" " open=" " close=" ">@{macro, redisRecordKey}</foreach> </select>
    <select id="selectWithOrderBy" resultType="net.hasor.dbvisitor.test.contract.material.model.UserInfo" resultTypeHandler="net.hasor.dbvisitor.types.handler.json.JsonTypeHandler"> ZRANGE ${orderColumn} 0 -1 </select>
    <select id="selectAsMaps" resultType="java.util.Map">ZRANGE @{macro, redisOwners} 0 -1 WITHSCORES</select>
    <select id="insertUser" resultSetExtractor="net.hasor.dbvisitor.test.realdb.redis.api.mapper.RedisIntegerResultExtractor"> EVAL "local u=cjson.decode(ARGV[1]); redis.call('ZADD',KEYS[1],u.id,ARGV[1]); redis.call('ZADD',KEYS[2],u.age,ARGV[1]); redis.call('HSET',KEYS[3],u.name..':'..u.age,ARGV[1]); return 1" 3 @{macro, redisUsers} @{macro, redisAges} @{macro, redisNames} #{#{'id':id,'name':name,'age':age,'email':email,'createTime':1L},typeHandler=net.hasor.dbvisitor.types.handler.json.JsonTypeHandler} </select>
    <select id="updateEmail" resultSetExtractor="net.hasor.dbvisitor.test.realdb.redis.api.mapper.RedisIntegerResultExtractor"> EVAL "local rows=redis.call('ZRANGEBYSCORE',KEYS[1],ARGV[1],ARGV[1]); if #rows==0 then return 0 end; local old=rows[1]; local u=cjson.decode(old); u.email=ARGV[2]; local new=cjson.encode(u); redis.call('ZREM',KEYS[1],old); redis.call('ZREM',KEYS[2],old); redis.call('ZADD',KEYS[1],u.id,new); redis.call('ZADD',KEYS[2],u.age,new); redis.call('HSET',KEYS[3],u.name..':'..u.age,new); return 1" 3 @{macro, redisUsers} @{macro, redisAges} @{macro, redisNames} #{id} #{email} </select>
    <select id="deleteById" resultSetExtractor="net.hasor.dbvisitor.test.realdb.redis.api.mapper.RedisIntegerResultExtractor"> EVAL "local rows=redis.call('ZRANGEBYSCORE',KEYS[1],ARGV[1],ARGV[1]); if #rows==0 then return 0 end; local old=rows[1]; local u=cjson.decode(old); redis.call('ZREM',KEYS[1],old); redis.call('ZREM',KEYS[2],old); redis.call('HDEL',KEYS[3],u.name..':'..u.age); return 1" 3 @{macro, redisUsers} @{macro, redisAges} @{macro, redisNames} #{id} </select>
    <select id="selectById" resultType="net.hasor.dbvisitor.test.contract.material.model.UserInfo" resultTypeHandler="net.hasor.dbvisitor.types.handler.json.JsonTypeHandler"> ZRANGEBYSCORE @{macro, redisUsers} #{id} #{id} </select>
    <select id="selectAll" resultType="net.hasor.dbvisitor.test.contract.material.model.UserInfo" resultTypeHandler="net.hasor.dbvisitor.types.handler.json.JsonTypeHandler"> ZRANGE @{macro, redisUsers} 0 -1 </select>
    <select id="queryUsersByAge" resultType="net.hasor.dbvisitor.test.contract.material.model.UserInfo" resultTypeHandler="net.hasor.dbvisitor.types.handler.json.JsonTypeHandler"> ZRANGEBYSCORE @{macro, redisAges} #{age} #{age} </select>
    <select id="countUsers" resultType="int">ZCARD @{macro, redisUsers}</select>
    <select id="queryUsersByCondition" resultType="net.hasor.dbvisitor.test.contract.material.model.UserInfo" resultTypeHandler="net.hasor.dbvisitor.types.handler.json.JsonTypeHandler"> HGET @{macro, redisNames} #{name + ':' + age} </select>
    <select id="queryUserByBean" resultType="net.hasor.dbvisitor.test.contract.material.model.UserInfo" resultTypeHandler="net.hasor.dbvisitor.types.handler.json.JsonTypeHandler"> HGET @{macro, redisNames} #{name + ':' + age} </select>
    <select id="insertOrder" resultSetExtractor="net.hasor.dbvisitor.test.realdb.redis.api.mapper.RedisIntegerResultExtractor"> EVAL "local o=cjson.decode(ARGV[1]); redis.call('ZADD',KEYS[1],o.id,ARGV[1]); redis.call('ZADD',KEYS[2],o.userId,ARGV[1]); return 1" 2 @{macro, redisOrders} @{macro, redisOwners} #{#{'id':id,'userId':userId,'orderNo':orderNo,'amount':amount},typeHandler=net.hasor.dbvisitor.types.handler.json.JsonTypeHandler} </select>
    <select id="deleteOrderById" resultSetExtractor="net.hasor.dbvisitor.test.realdb.redis.api.mapper.RedisIntegerResultExtractor"> EVAL "local rows=redis.call('ZRANGEBYSCORE',KEYS[1],ARGV[1],ARGV[1]); if #rows==0 then return 0 end; redis.call('ZREM',KEYS[1],rows[1]); redis.call('ZREM',KEYS[2],rows[1]); return 1" 2 @{macro, redisOrders} @{macro, redisOwners} #{id} </select>
    <select id="queryOrdersByUserId" resultType="net.hasor.dbvisitor.test.contract.material.model.UserOrder" resultTypeHandler="net.hasor.dbvisitor.types.handler.json.JsonTypeHandler"> ZRANGEBYSCORE @{macro, redisOwners} #{userId} #{userId} </select>
</mapper>
