<?xml version="1.0" encoding="UTF-8"?>
<!DOCTYPE mapper PUBLIC "-//dbvisitor.net//DTD Mapper 1.0//EN" "https://www.dbvisitor.net/schema/dbvisitor-mapper.dtd">
<mapper namespace="resultMap_test">
    <resultMap id="blobResourceDO" type="net.hasor.test.db.dto.TB_User" autoMapping="true">
        <id column="id" property="id"/>
        <result column="gmt_create" property="gmtCreate"/>
        <result column="gmt_modified" property="gmtModified"/>
        <result column="instance_id" property="instanceId"/>
        <result column="owner_name" property="ownerName"/>
        <result column="owner_type" property="ownerType" javaType="com.clougence.clouddm.console.web.constants.ResourceType"/>
        <result column="blob_type" property="blobType" javaType="com.clougence.clouddm.console.web.constants.SecurityFileType"/>
        <result column="content" property="content"/>
    </resultMap>

    <resultMap id="blobResourceDO" type="net.hasor.test.db.dto.TB_User" autoMapping="true">
        <id column="id" property="id"/>
        <result column="gmt_create" property="gmtCreate"/>
        <result column="gmt_modified" property="gmtModified"/>
        <result column="instance_id" property="instanceId"/>
        <result column="owner_name" property="ownerName"/>
        <result column="owner_type" property="ownerType" javaType="com.clougence.clouddm.console.web.constants.ResourceType"/>
        <result column="blob_type" property="blobType" javaType="com.clougence.clouddm.console.web.constants.SecurityFileType"/>
        <result column="content" property="content"/>
    </resultMap>
</mapper>