<?xml version="1.0" encoding="UTF-8"?>
<!DOCTYPE mapper PUBLIC "-//dbvisitor.net//DTD Mapper 1.0//EN" "https://www.dbvisitor.net/schema/dbvisitor-mapper.dtd">
<mapper autoMapping="true">
    <resultMap id="mapper_2" type="net.hasor.test.db.dto.TbUser"/>

    <resultMap id="mapper_3" type="net.hasor.test.db.dto.TbUser2"/>

    <resultMap id="mapper_4" type="net.hasor.test.db.dto.TbUser2" autoMapping="false">
        <id column="user_uuid" property="uid"/>
        <result column="name" property="name"/>
        <result column="login_name" property="account"/>
        <result column="login_password" property="password"/>
        <result column="email" property="mail"/>
        <result column="index" property="index" javaType="int"/>
        <result column="register_time" property="createTime"/>
    </resultMap>

    <resultMap id="mapper_5" type="net.hasor.test.db.dto.TbUser2" mapUnderscoreToCamelCase="true"/>
</mapper>